title,link,pub_date,category,creator,description,content_html,contents_p,image,comments,guid
연말 몰린 스팩(SPAC)주 신규상장… “주가 변동성 커 투자자 유의 필요”,https://www.chosun.com/economy/money/2025/12/04/QDGRTPWD7VDTTIPTNNJ7GGAFXE/,"Thu, 04 Dec 2025 00:02:46 +0000",,유재인 기자,,"<img src=""https://www.chosun.com/resizer/v2/ME4TCZBQGE4TIOLDMY2TGNBZGI.jpg?auth=632ab1803b171e5b52c76926fb416ec7fc1d646295b392940a60c6d0139ac5b9&smart=true&width=3961&height=2718"" alt=""3일 서울 중구 하나은행 본점 딜링룸 전광판에 증시 종가가 표시되고 있다. 이날 코스피 지수는 전 거래일 대비 41.37p(1.04%) 상승한 4036.30로 장을 마감했다. 2025.12.3/뉴스1 ⓒ News1 이호윤 기자"" height=""2718"" width=""3961""/><p>이달 들어 신규 상장된 스팩(SPAC)주들에 대한 관심이 이어지고 있다. 스팩은 비상장 기업의 상장을 돕기 위해 설립되는 합병 전용 상장회사를 뜻한다. </p>",이달 들어 신규 상장된 스팩(SPAC)주들에 대한 관심이 이어지고 있다. 스팩은 비상장 기업의 상장을 돕기 위해 설립되는 합병 전용 상장회사를 뜻한다.,,,https://www.chosun.com/economy/money/2025/12/04/QDGRTPWD7VDTTIPTNNJ7GGAFXE/
"돌아온 외국인, 이달 코스피 사흘 연속 순매수… 추세 전환은 브로드컴 실적이 변수",https://www.chosun.com/economy/money/2025/12/04/534IHH2YSNBMHCCD24GSE45WDM/,"Thu, 04 Dec 2025 00:00:39 +0000",,안중현 기자,,"<img src=""https://www.chosun.com/resizer/v2/ME4TCZBQGE4TIOLDMY2TGNBZGI.jpg?auth=632ab1803b171e5b52c76926fb416ec7fc1d646295b392940a60c6d0139ac5b9&smart=true&width=3961&height=2718"" alt=""3일 서울 중구 하나은행 본점 딜링룸 전광판에 증시 종가가 표시되고 있다. 이날 코스피 지수는 전 거래일 대비 41.37p(1.04%) 상승한 4036.30로 장을 마감했다. /뉴스1"" height=""2718"" width=""3961""/><p>이달 들어 외국인 투자자가 유가증권시장에서 완연한 ‘매수 모드’로 돌아서며 연말 랠리에 대한 기대감이 커지고 있다. 지난달 유가증권시장에서 14조원 넘게 국내 주식을 팔아치우며 시장을 짓눌렀던 외국인이 이달 들어 3거래일 연속 순매수(매수가 매도보다 많은 것)를 기록하면서 코스피가 4000선을 회복하는 등 투자심리도 살아나는 분위기다. 반도체 등 주도 업종이 대거 조정을 받으며 가격 매력이 부각된 데다 인공지능(AI) ‘거품’ 우려 완화와 환율 변동성 축소가 외국인 매수세의 배경으로 지목된다.</p>",이달 들어 외국인 투자자가 유가증권시장에서 완연한 ‘매수 모드’로 돌아서며 연말 랠리에 대한 기대감이 커지고 있다. 지난달 유가증권시장에서 14조원 넘게 국내 주식을 팔아치우며 시장을 짓눌렀던 외국인이 이달 들어 3거래일 연속 순매수(매수가 매도보다 많은 것)를 기록하면서 코스피가 4000선을 회복하는 등 투자심리도 살아나는 분위기다. 반도체 등 주도 업종이 대거 조정을 받으며 가격 매력이 부각된 데다 인공지능(AI) ‘거품’ 우려 완화와 환율 변동성 축소가 외국인 매수세의 배경으로 지목된다.,,,https://www.chosun.com/economy/money/2025/12/04/534IHH2YSNBMHCCD24GSE45WDM/
“날 닮아 아토피 타고난 아들에 심장 덜컥” 보습크림 손수 개발한 소아과 의사,https://www.chosun.com/economy/startup_story/2025/10/30/SJYTKLGMGREEVCHKTSOVYEHTGE/,"Wed, 29 Oct 2025 20:35:00 +0000",,"이영지 더비비드 기자, 박유연 기자",,"<img src=""https://www.chosun.com/resizer/v2/VI7VC4NPPBARLJZTPPFY7C4WBY.JPG?auth=4dc53f68e4f0866786b77bf3b43d0da121e77653746073b3ef73fd3fcc282bf0&smart=true&width=5452&height=3452"" alt=""딜라이트코스메틱 김정은 대표. /더비비드"" height=""3452"" width=""5452""/><p>아토피 피부염은 가장 흔한 염증성 피부 질환이다. 지독한 가려움증으로 인해 고통을 겪고, 발진이 일어난 부위를 긁다가 상처나 흉터가 생기기도 한다. 아토피 피부염의 정확한 원인은 밝혀지지 않았지만 가족력이 크게 작용하는 것으로 알려져 있다. 전문가들은 아토피 피부염 환자의 70~80%가 가족력이 있다고 분석한다.</p>","아토피 피부염은 가장 흔한 염증성 피부 질환이다. 지독한 가려움증으로 인해 고통을 겪고, 발진이 일어난 부위를 긁다가 상처나 흉터가 생기기도 한다. 아토피 피부염의 정확한 원인은 밝혀지지 않았지만 가족력이 크게 작용하는 것으로 알려져 있다. 전문가들은 아토피 피부염 환자의 70~80%가 가족력이 있다고 분석한다.",https://www.chosun.com/resizer/v2/VI7VC4NPPBARLJZTPPFY7C4WBY.JPG?auth=4dc53f68e4f0866786b77bf3b43d0da121e77653746073b3ef73fd3fcc282bf0&smart=true&width=5452&height=3452,,https://www.chosun.com/economy/startup_story/2025/10/30/SJYTKLGMGREEVCHKTSOVYEHTGE/
"北 “무상 보육시설·양로원, 사회주의 우리 조국에만 있어” 주장",https://www.chosun.com/politics/north_korea/2025/12/04/PZ2JMJW27RC63M5GAAKNZRMVXM/,"Wed, 03 Dec 2025 23:53:22 +0000",,김경필 기자,,"<img src=""https://www.chosun.com/resizer/v2/IQYNXLXE2ZPOHAZXLLJ42HGUZQ.JPG?auth=0fa6b6434caab7d513d95340bc6a23e4a777d10dd772de8c1d93273284b9cf73&smart=true&width=780&height=467"" alt=""북한 노동당 기관지 노동신문은 4일 “전국 각지에 멋들어지게 솟아난 육아원, 애육원, 초등학원, 중등학원, 양로원들도 모든 인민들이 무탈하여 편안하고 화목하게 살아가는 공산주의 사회를 하루빨리 건설하기 위해 천만품을 들이는 우리 당의 위대한 손길이 낳은 세상에 둘도 없는 재부들”이라고 보도했다. /노동신문 뉴스1"" height=""467"" width=""780""/><p>북한 노동당 기관지 노동신문이 “당과 국가가 육아원, 애육원(보육원), 초등·중등학원의 원아들과 양로원의 연로자들을 전적으로 맡아 책임지고 보살피며 온갖 정성을 기울여 떠받드는 나라는 사회주의 우리 조국뿐”이라고 주장했다.</p>","북한 노동당 기관지 노동신문이 “당과 국가가 육아원, 애육원(보육원), 초등·중등학원의 원아들과 양로원의 연로자들을 전적으로 맡아 책임지고 보살피며 온갖 정성을 기울여 떠받드는 나라는 사회주의 우리 조국뿐”이라고 주장했다.",,,https://www.chosun.com/politics/north_korea/2025/12/04/PZ2JMJW27RC63M5GAAKNZRMVXM/
"교육 예산의 28%를 삼키는 교사 연금… 프랑스, 신규 임용 어려워",https://www.chosun.com/opinion/specialist_column/2025/12/03/YHME4NMH4RGOFDVL7JMN7JYI6I/,"Wed, 03 Dec 2025 14:46:00 +0000",,조귀동 경제칼럼니스트,,"<p>프랑스 북서부 도시 캉에서 고교에 다니는 리디 비주아른씨의 딸은 올해 독학으로 프랑스어 시험을 준비해야 했다. 담당 교사가 지난해 11월 휴직했는데, 계약직 교사가 2월 말에야 부임했기 때문이다. 비주아른씨는 일간 르몽드에 “다른 학생들이 10번 넘게 한 모의연습을 내 딸은 2번밖에 못했다”며 분통을 터뜨렸다. 남서부 앵 지역의 페르네볼테르 국제고교는 아예 1년 내내 프랑스어 교사가 없었다. 학교는 온라인으로 수업 시수를 때웠다. 학부모들이 관할 교육청에 여러 번 신고했지만 소용이 없었다.</p><p>프랑스에서는 바칼로레아(고교 졸업 시험)에서 일정 이상 점수를 얻으면 누구나 대학에 진학할 수 있다. 평등하게 교육 기회를 누려야 한다는 취지다. 그런데 정작 학교에 교사가 없어 바칼로레아를 제대로 준비하지 못하는 학생이 허다하다. 예산이 부족해 교사를 제대로 충원하지 못하기 때문이다. </p>","프랑스 북서부 도시 캉에서 고교에 다니는 리디 비주아른씨의 딸은 올해 독학으로 프랑스어 시험을 준비해야 했다. 담당 교사가 지난해 11월 휴직했는데, 계약직 교사가 2월 말에야 부임했기 때문이다. 비주아른씨는 일간 르몽드에 “다른 학생들이 10번 넘게 한 모의연습을 내 딸은 2번밖에 못했다”며 분통을 터뜨렸다. 남서부 앵 지역의 페르네볼테르 국제고교는 아예 1년 내내 프랑스어 교사가 없었다. 학교는 온라인으로 수업 시수를 때웠다. 학부모들이 관할 교육청에 여러 번 신고했지만 소용이 없었다.",https://www.chosun.com/resizer/v2/JKOOVHX5CNGIDLNPJSQYWNDKLY.jpg?auth=e3bffee26990fd83e5e8476fee78051f3dc246c9f098e11d303826dbce783832&smart=true&width=480&height=271,,https://www.chosun.com/opinion/specialist_column/2025/12/03/YHME4NMH4RGOFDVL7JMN7JYI6I/
"박찬호 이어 최형우까지 이탈…KIA, 공격력 약화 어쩌나",https://www.chosun.com/sports/baseball/2025/12/04/G4ILXV74FRCL7OP3STXUJUP5NM/,"Thu, 04 Dec 2025 00:56:52 +0000",,뉴시스,,"<img src=""https://www.chosun.com/resizer/v2/MUJHSDNXWBGRG252S222KGVT2Y.jpg?auth=d251102fb496fe8474ef20aaad4813d2d2e38e7748bff9c8120afbad43daba77&smart=true&width=719&height=479"" alt=""최형우"" height=""479"" width=""719""/><p>프로야구 KIA 타이거즈가 리그 최정상급 유격수 박찬호에 이어 장타 생산력을 갖춘 최형우를 붙잡는 데도 실패했다. 두 명의 주축 선수와 결별한 KIA는 공격력 약화가 불가피해졌다.</p>",프로야구 KIA 타이거즈가 리그 최정상급 유격수 박찬호에 이어 장타 생산력을 갖춘 최형우를 붙잡는 데도 실패했다. 두 명의 주축 선수와 결별한 KIA는 공격력 약화가 불가피해졌다.,https://www.chosun.com/resizer/v2/UAT5UQ5E4NAG5NBSFPVIN7LADQ.JPG?auth=48b027dec3d803ad36ee8f74cd0f40ff3df7b799a04760f1b364732bf81f2316&smart=true&width=1070&height=802,,https://www.chosun.com/sports/baseball/2025/12/04/G4ILXV74FRCL7OP3STXUJUP5NM/
경기지사 민주 김동연 35.0% 추미애 15.0%… 국힘 유승민 26.8% 한동훈 15.5%,https://www.chosun.com/politics/opinion-poll/2025/12/04/CKOJ3WEXEBC2RJ6MEA36IP45YI/,"Wed, 03 Dec 2025 23:37:45 +0000",,김경필 기자,,"<p>내년 6·3 지방선거 경기지사 후보 적합도 여론조사에서 더불어민주당 후보로는 김동연 경기지사가 35.0%로 1위, 추미애 의원이 15.0%로 2위를 차지한 것으로 나타났다. 국민의힘 후보로는 유승민 전 의원이 26.8%로 1위, 한동훈 전 국민의힘 대표가 15.5%로 2위였다.</p><p>경기일보가 여론조사 업체 조원씨앤아이·글로벌리서치에 의뢰해 지난달 29~30일 경기도에 사는 18세 이상 1000명을 대상으로 한 조사 결과에 따르면, 민주당 후보 적합도 조사에서는 김 지사가 35.0%, 추 의원이 15.0%, 한준호 의원이 9.2%를 받았다. 이어서 김용민 의원 6.3%, 김병주 의원 6.3%, 강득구 의원 1.5%, 그 밖의 후보 0.4%였다. 적합한 후보가 없다거나 잘 모르겠다는 응답자는 26.3%였다.</p>","내년 6·3 지방선거 경기지사 후보 적합도 여론조사에서 더불어민주당 후보로는 김동연 경기지사가 35.0%로 1위, 추미애 의원이 15.0%로 2위를 차지한 것으로 나타났다. 국민의힘 후보로는 유승민 전 의원이 26.8%로 1위, 한동훈 전 국민의힘 대표가 15.5%로 2위였다.",https://www.chosun.com/resizer/v2/GFRGGYJVHFRDGNRWG5RTQNRVMI.jpg?auth=fd62b9205996cc1e8a3621ae44810cab1ce8b0f5d9890fe46a084f7c4a6f751d&smart=true&width=4217&height=2812,,https://www.chosun.com/politics/opinion-poll/2025/12/04/CKOJ3WEXEBC2RJ6MEA36IP45YI/
"LS일렉트릭, 부산사업장 제2생산동 준공",https://www.chosun.com/economy/tech_it/2025/12/04/VVWO7IFQNFHUDM2KR27NTPHVSM/,"Wed, 03 Dec 2025 23:00:00 +0000",,박지민 기자,,"<img src=""https://www.chosun.com/resizer/v2/UGGO3TZRQBHWZEYG5PCX3HWYDA.jpg?auth=02801a411359c4c78f3ba59e274affce418b474240a6e2d699f9cc8625479999&smart=true&width=2112&height=1582"" alt=""LS일렉트릭 부산 사업장 제2 생산동 전경. /LS일렉트릭"" height=""1582"" width=""2112""/><p>LS일렉트릭은 부산 사업장 초고압 변압기 제2 생산동을 준공하고, 북미를 중심으로 글로벌 초고압 변압기 시장 공략을 가속화한다고 4일 밝혔다. </p>","LS일렉트릭은 부산 사업장 초고압 변압기 제2 생산동을 준공하고, 북미를 중심으로 글로벌 초고압 변압기 시장 공략을 가속화한다고 4일 밝혔다.",,,https://www.chosun.com/economy/tech_it/2025/12/04/VVWO7IFQNFHUDM2KR27NTPHVSM/
브라질서 ‘한국 오빠와 데이트’ 사이트...한류 여성 팬 성착취 의혹,https://www.chosun.com/international/international_general/2025/12/04/SMPSQQ6KIBEGLGBXQ7JSR4L6QY/,"Thu, 04 Dec 2025 00:55:33 +0000",,정아임 기자,,"<img src=""https://www.chosun.com/resizer/v2/PILVY2OJ6BDHJJJHSZJWKEEWMI.png?auth=7f8474b5163bd7155400d271c2aab4304e0ef4ab2b37d90b2d8d50f819de20ea&smart=true&width=1200&height=627"" alt=""‘한국 남성과의 만남을 주선한다’는 브라질 웹사이트 화면./홈페이지 캡처"" height=""627"" width=""1200""/><p>브라질에서 한류 여성 팬을 노린 성 착취 범죄와 관련된 것으로 의심되는 유료 만남 사이트가 발견돼 현지 경찰이 수사에 착수했다.</p>",브라질에서 한류 여성 팬을 노린 성 착취 범죄와 관련된 것으로 의심되는 유료 만남 사이트가 발견돼 현지 경찰이 수사에 착수했다.,,,https://www.chosun.com/international/international_general/2025/12/04/SMPSQQ6KIBEGLGBXQ7JSR4L6QY/
"'연봉 100억' 정승제, '미혼' 이유 직접 밝혔다…""적성에 안 맞아"" ('정승제하숙집')[종합]",https://www.chosun.com/entertainments/broadcast/2025/12/04/G43DEM3FGY3WMMZQMFQTAYTCGA/,"Thu, 04 Dec 2025 00:55:00 +0000",,OSEN,&lt;방송사에서 제공한 자료를 바탕으로 작성된 리뷰 기사입니다.&gt;[OSEN=장우영 기자] &lsquo;정승제 하숙집&rsquo;이 정승제의 본격적인 인생 과외와 진짜 청춘의 민낯을 담은 &lsquo;리얼 하숙 라이프&rsquo;로 시청자를 사로잡았다.3일 방송된 티캐스트 E채널 &lsquo;인생 때려잡기: 정승제 하숙집&rsquo;(이하 &lsquo,"<img src=""https://www.chosun.com/resizer/v2/G4YTCN3FGA2WCNLCGNSDEODGMU.jpg?auth=c4105a3bf749058fb0d04b2e04a9e9205e7d80289758520f897cfccbd044b39e&smart=true&width=530&height=834"" alt="""" height=""834"" width=""530""/><p>&lt;방송사에서 제공한 자료를 바탕으로 작성된 리뷰 기사입니다.&gt;</p>",<방송사에서 제공한 자료를 바탕으로 작성된 리뷰 기사입니다.>,https://www.chosun.com/resizer/v2/G4YTCN3FGA2WCNLCGNSDEODGMU.jpg?auth=c4105a3bf749058fb0d04b2e04a9e9205e7d80289758520f897cfccbd044b39e&smart=true&width=530&height=834,,https://www.chosun.com/entertainments/broadcast/2025/12/04/G43DEM3FGY3WMMZQMFQTAYTCGA/
“김수용 귓불주름은 노화 현상”… 흉부외과 교수가 밝힌 심근경색 전조증상은,https://www.chosun.com/national/national_general/2025/12/04/4OGLUOFDQZC6PH4SPMB3XP4IFE/,"Wed, 03 Dec 2025 22:40:53 +0000",,김자아 기자,,"<img src=""https://www.chosun.com/resizer/v2/NK3DO5IU65EGNIKRE33Z3MFBEQ.png?auth=84ce91204289994ff513c9bc0932b5fce88be38abc1b5a1978367838841b7e59&smart=true&width=1200&height=800"" alt=""김수용 귓볼 주름. /인스타그램"" height=""800"" width=""1200""/><p>귓불 주름이 심근경색의 전조증상일 수 있다는 견해가 온라인상에 퍼진 것과 관련 유명 흉부외과 전문의가 의학적 인과관계가 있다고 보기 어렵다는 의견을 밝혔다.</p>",귓불 주름이 심근경색의 전조증상일 수 있다는 견해가 온라인상에 퍼진 것과 관련 유명 흉부외과 전문의가 의학적 인과관계가 있다고 보기 어렵다는 의견을 밝혔다.,https://www.chosun.com/resizer/v2/BH5YYGPF3VDRNJH7W4PHGHX35M.jpg?auth=4812d0e610db4fc88710988987afef501c8b73edfeee24bd56281cc19548b384&smart=true&width=345&height=259,,https://www.chosun.com/national/national_general/2025/12/04/4OGLUOFDQZC6PH4SPMB3XP4IFE/
美 고용시장에 적신호 켜지자 뛰어오른 뉴욕증시... 다우 0.9%↑,https://www.chosun.com/international/international_general/2025/12/04/SRZHEJCOUVGETAGBSTWMCM5LWI/,"Wed, 03 Dec 2025 21:10:23 +0000",,뉴욕=윤주헌 특파원,,"<img src=""https://www.chosun.com/resizer/v2/X66FFVIQYZIKLBQNNG2S5BZJLM.jpg?auth=6213549c8d55081bd9572ffc5eb8bd82f8a150a6432e77fea514d067a1309dea&smart=true&width=8126&height=5129"" alt=""미국 뉴욕증시는 3일 일제히 상승했다.
/AFP 연합뉴스"" height=""5129"" width=""8126""/><p>미국 뉴욕 증시가 3일(현지 시각) 일제히 상승했다. 이날 오전 공개된 자료에서 11월 미국의 민간 기업 고용이 예상에 크게 못 미쳤다는 점이 확인되면서 10일 연방준비제도(연준) 기준금리 인하 가능성이 높아진 영향을 받았다. 또 금리 인하 필요성을 강조하는 케빈 해싯 국가경제위원회(NEC) 위원장이 차기 연준 의장에 낙점될 가능성이 높다는 점도 반영된 것으로 보인다. 가상 화폐 비트코인은 전날에 이어 상승세를 이어 갔다.</p>",미국 뉴욕 증시가 3일(현지 시각) 일제히 상승했다. 이날 오전 공개된 자료에서 11월 미국의 민간 기업 고용이 예상에 크게 못 미쳤다는 점이 확인되면서 10일 연방준비제도(연준) 기준금리 인하 가능성이 높아진 영향을 받았다. 또 금리 인하 필요성을 강조하는 케빈 해싯 국가경제위원회(NEC) 위원장이 차기 연준 의장에 낙점될 가능성이 높다는 점도 반영된 것으로 보인다. 가상 화폐 비트코인은 전날에 이어 상승세를 이어 갔다.,,,https://www.chosun.com/international/international_general/2025/12/04/SRZHEJCOUVGETAGBSTWMCM5LWI/
"천대엽, 내란재판부 설치법에 “삼권분립 역사의 뒤안으로 사라져”",https://www.chosun.com/national/court_law/2025/12/03/7VDD5PI7GVHITHFO76D2AMQCSI/,"Wed, 03 Dec 2025 14:03:44 +0000",,김은경 기자,,"<img src=""https://www.chosun.com/resizer/v2/7CO426J3KBJVXB7T2MAFWIHNVE.jpg?auth=8df932b7af4dbea0a5fba8f9a93b99f9946e871c05cdeaa322599fde121b0ba8&smart=true&width=1897&height=1387"" alt=""천대엽 법원행정처장이 3일 서울 여의도 국회에서 열린 제429회 국회(정기회) 법제사법위원회 제16차 전체회의에서 의원들 질의에 답하고 있다. /연합뉴스"" height=""1387"" width=""1897""/><p>천대엽 법원행정처장은 3일 더불어민주당이 추진하는 내란전담재판부 설치법이 시행되면 “87년 헌법 아래서 누렸던 삼권분립과 사법부 독립이 역사의 뒤안으로 사라질 수 있다”고 했다.</p>",천대엽 법원행정처장은 3일 더불어민주당이 추진하는 내란전담재판부 설치법이 시행되면 “87년 헌법 아래서 누렸던 삼권분립과 사법부 독립이 역사의 뒤안으로 사라질 수 있다”고 했다.,,,https://www.chosun.com/national/court_law/2025/12/03/7VDD5PI7GVHITHFO76D2AMQCSI/
카터의 ‘주한 미군 철수’ 저지... 그 뒤에 정주영 회장이 있었다,https://www.chosun.com/economy/economy_general/2025/12/04/E5DMKN27GJGEBL4AKV4RSBAXNE/,"Wed, 03 Dec 2025 18:00:00 +0000",,박정웅 ㈜메이텍 대표·前태평양경제협의회 한국사무국장,,"<p><style>.pre_wrap{ display: flex; flex-wrap: wrap; } .pre_img {  width: 100%; } .pre_img { display: block !important; } .pre_img_mobile { display: none !important;} @media only screen and (max-width: 689px) { .pre_img_pc {display: none !important;} .pre_img_mobile { display: block !important;} } </style> 
<div class=""pre_wrap"">
	<img src=""https://cloudfront-ap-northeast-1.images.arcpublishing.com/chosun/VOAM5PGGHFFPVL2R6K2EOBGTRA.jpg"" alt="""" class=""pre_img pre_img_pc"">
	<img  src=""https://cloudfront-ap-northeast-1.images.arcpublishing.com/chosun/FYNEXBUOH5DFPNQIRRLFYRCUP4.jpg"" alt="""" class=""pre_img pre_img_mobile"">
</div>
<p style="" font-family: NotoSansKR-Regular, sans-serif; font-weight: 400; color: #707070;padding-top: 8px;  font-size: 14px; margin: 0; text-align: left; display: block; word-break: keep-all;"">사진=조선DB·연합뉴스, 그래픽=조선디자인랩 정다운</p></p><p>“수출을 해야 먹고사는 나라인데, 언제 난리가 날지 모르는 나라에 누가 주문을 합니까? 또 투자를 하는 나라는 어디 있겠습니까? 우리 국가 안보는 나라 경제의 생사의 문제입니다. 우리 경제계도 사업 영역을 따지지 말고 발 벗고 나서야 합니다.” </p>","사진=조선DB·연합뉴스, 그래픽=조선디자인랩 정다운",https://www.chosun.com/resizer/v2/VOAM5PGGHFFPVL2R6K2EOBGTRA.jpg?auth=1fb809813af71481b35ab0780ecfea33c42f5234d760b292305f05a30589a27c&smart=true&width=2560&height=1440,,https://www.chosun.com/economy/economy_general/2025/12/04/E5DMKN27GJGEBL4AKV4RSBAXNE/
"장기용, 멋진데 웃기기까지…글로벌 여심 싹쓸이한 매력덩이(‘키스는 괜히 해서’)",https://www.chosun.com/entertainments/broadcast/2025/12/04/GBRTAMLDGI4DAOJVGRRGGYZVMU/,"Thu, 04 Dec 2025 00:53:00 +0000",,OSEN,"[OSEN=강서정 기자] &lsquo;키스는 괜히 해서!&rsquo;&nbsp;블랙홀 같은 장기용의 매력에 글로벌 여심이 들썩인다.SBS&nbsp;수목드라마&nbsp;&lsquo;키스는 괜히 해서!&rsquo;(극본 하윤아,&nbsp;태경민, 연출 김재현,&nbsp;김현우)가 국내를 넘어 해외에서까지 폭발적인 반응을 이끌고 있다.&nbsp;전 채널 평일 드","<img src=""https://www.chosun.com/resizer/v2/HFSWEYRTHBRTCODGGJTGCMJVMU.jpg?auth=51185f5fa2c4673af839b668dd3a5941dab8509aab98331902c1bd6ff0c8b3fb&smart=true&width=650&height=487"" alt="""" height=""487"" width=""650""/><p>[OSEN=강서정 기자] &lsquo;키스는 괜히 해서!&rsquo;&nbsp;블랙홀 같은 장기용의 매력에 글로벌 여심이 들썩인다.</p>",[OSEN=강서정 기자] ‘키스는 괜히 해서!’ 블랙홀 같은 장기용의 매력에 글로벌 여심이 들썩인다.,https://www.chosun.com/resizer/v2/HFSWEYRTHBRTCODGGJTGCMJVMU.jpg?auth=51185f5fa2c4673af839b668dd3a5941dab8509aab98331902c1bd6ff0c8b3fb&smart=true&width=650&height=487,,https://www.chosun.com/entertainments/broadcast/2025/12/04/GBRTAMLDGI4DAOJVGRRGGYZVMU/
‘K-OTT 공룡’ 탄생 막는 KT 몽니?... 티빙·웨이브 합병 지지부진,https://www.chosun.com/economy/tech_it/2025/12/04/LE5YHGMOO5GQHFGO4LOBMAPFUQ/,"Wed, 03 Dec 2025 21:00:01 +0000",,김강한 기자,,"<img src=""https://www.chosun.com/resizer/v2/PP2KUZ6WCVGKROHNPGADIOIC3A.jpg?auth=872861156662dba84950c18082487cab7480ec9714ae53e6a1133c10f5591def&smart=true&width=720&height=133"" alt=""티빙 웨이브"" height=""133"" width=""720""/><p>토종 OTT(온라인동영상서비스) 티빙과 웨이브가 합병을 위한 양해각서(MOU)를 체결한 지 어느덧 2년이 지났습니다. 그러나 아직 정확한 합병 시점을 정하지 못하고 있습니다. KT가 반대하고 있기 때문입니다. </p>",토종 OTT(온라인동영상서비스) 티빙과 웨이브가 합병을 위한 양해각서(MOU)를 체결한 지 어느덧 2년이 지났습니다. 그러나 아직 정확한 합병 시점을 정하지 못하고 있습니다. KT가 반대하고 있기 때문입니다.,https://www.chosun.com/resizer/v2/XKFFS54IRFDO7F7MH2U2CS4IYU.jpg?auth=2038bb19409076d235b500f73415a706cf5230a8570a0627846088c0220a4ca3&smart=true&width=629&height=472,,https://www.chosun.com/economy/tech_it/2025/12/04/LE5YHGMOO5GQHFGO4LOBMAPFUQ/
"정세현 “대통령 참모들, 그러고도 월급 받나... 저 같으면 개각”",https://www.chosun.com/politics/politics_general/2025/12/03/ZLH2HEBFANFPTPZSNOY5XNVKRI/,"Wed, 03 Dec 2025 13:29:14 +0000",,김민서 기자,,"<p>이재명 정부 출범 6개월을 맞이해 열린 ‘남북관계 원로 특별좌담’에 참여한 친여(親與) 성향의 원로 인사들이 정부의 ‘END구상’을 수정하고 국가안전보장회의(NSC) 조직 개편 및 개각 필요성을 제기했다. </p><img src=""https://www.chosun.com/resizer/v2/MQYTMYLCGQ4DSZLDMI2GEOJTMI.jpg?auth=fd2462a36b3abc14bf1042526fa9bc510f98fae725a8173a30eed068296ae6c4&smart=true&width=5730&height=3682"" alt=""정동영 통일부 장관(오른쪽에서 네번째)이 3일 서울 중구 한국프레스센터에서 한반도평화포럼이 '이재명 정부 통일외교안보 정책:평가와 전망'을 주제로 개최한 남북관계 원로 특별좌담회 참석자들과 기념촬영을 하고 있다. 왼쪽부터 김연철 한반도평화포럼 이사장, 문정인 연세대 명예교수, 정현백 전 여가부장관, 임동원 한반도평화포럼 명예이사장, 정동영 장관, 정세현 전 통일부장관, 이재정 전 통일부장관, 양무진 북한대핵원대학교 석좌교수. /뉴스1"" height=""3682"" width=""5730""/>",이재명 정부 출범 6개월을 맞이해 열린 ‘남북관계 원로 특별좌담’에 참여한 친여(親與) 성향의 원로 인사들이 정부의 ‘END구상’을 수정하고 국가안전보장회의(NSC) 조직 개편 및 개각 필요성을 제기했다.,,,https://www.chosun.com/politics/politics_general/2025/12/03/ZLH2HEBFANFPTPZSNOY5XNVKRI/
