title,link,pub_date,category,creator,description,content_html,contents_p,image,comments,guid
"'런던의 왕' 손흥민이 돌아온다…英 BBC 대서특필! 만원관중 앞 마지막 경기→홈 작별 인사 ""정말 기쁘다""",https://www.chosun.com/sports/world-football/2025/12/04/HE2GGNDCGBSGIMTFGEZWGMLBGM/,"Thu, 04 Dec 2025 00:51:34 +0000",,스포츠조선,[스포츠조선 김가을 기자]'런던의 왕' 손흥민(LA FC)이 토트넘으로 돌아온다. 토트넘은 3일(이하 한국시각) 구단 공식 채널을 통해 '손흥민이 10일 슬라비아 프라하(체코)와의 2025~2026시즌 유럽챔피언스리그(UCL) 리그페이즈 경기에서 홈 팬들에게 작별 인사를 하기 위해 팀을 떠난 뒤 처음으로 토트넘 홋스퍼 스타디움에 돌아온다. 메이저 리그 사커,"<img src=""https://www.chosun.com/resizer/v2/GI3GKYRSMQ2TIMZZMY3WIZRRGE.jpg?auth=646a1fd07bab41bc5fe00a032ed129e9f555153b7382af0ca48d34b2198a6ef0&smart=true&width=648&height=853"" alt=""사진=토트넘 구단 공식 SNS 캡처"" height=""853"" width=""648""/><p>[스포츠조선 김가을 기자]'런던의 왕' 손흥민(LA FC)이 토트넘으로 돌아온다.</p>",[스포츠조선 김가을 기자]'런던의 왕' 손흥민(LA FC)이 토트넘으로 돌아온다.,https://www.chosun.com/resizer/v2/GI3GKYRSMQ2TIMZZMY3WIZRRGE.jpg?auth=646a1fd07bab41bc5fe00a032ed129e9f555153b7382af0ca48d34b2198a6ef0&smart=true&width=648&height=853,,https://www.chosun.com/sports/world-football/2025/12/04/HE2GGNDCGBSGIMTFGEZWGMLBGM/
"‘최형우 직격탄’ 사라진 경쟁→차가운 시장, 김재환, 두산 제시액도 못 받으면 명분·실리 다 날린다",https://www.chosun.com/sports/baseball/2025/12/04/MQYTOZBSMU3GENTBMYYGMZDGGQ/,"Thu, 04 Dec 2025 00:43:26 +0000",,스포츠조선,,"<img src=""https://www.chosun.com/resizer/v2/GE4DCMRRGEYTAMZRGI3GIOBWGM.jpg?auth=2e50c2616cb277d281a9a8d0d5de67b010c5bc593c02da929c90c8c6aaeae379&smart=true&width=650&height=836"" alt=""스포츠조선DB"" height=""836"" width=""650""/><p>두산 베어스를 떠나 새 팀을 물색중인 김재환이 위기에 봉착했다. 시장 분위기가 예상보다 차갑다.</p>",두산 베어스를 떠나 새 팀을 물색중인 김재환이 위기에 봉착했다. 시장 분위기가 예상보다 차갑다.,https://www.chosun.com/resizer/v2/GE4DCMRRGEYTAMZRGI3GIOBWGM.jpg?auth=2e50c2616cb277d281a9a8d0d5de67b010c5bc593c02da929c90c8c6aaeae379&smart=true&width=650&height=836,,https://www.chosun.com/sports/baseball/2025/12/04/MQYTOZBSMU3GENTBMYYGMZDGGQ/
‘내란죄’는 사면복권서 제외... 법사위서 與 단독 처리,https://www.chosun.com/politics/assembly/2025/12/03/WA5Y35AO7JDIPLFOXQO33QBGRA/,"Wed, 03 Dec 2025 13:26:33 +0000",,김상윤 기자,,"<img src=""https://www.chosun.com/resizer/v2/GLIQGFIA5VO65LZ5ZEOX5YRGOM.jpg?auth=b3ce61da5ed948f8ce05c0953228058f7430e0e0266956de77c3f1f9a904f1b0&smart=true&width=5424&height=3616"" alt=""3일 밤 국회 법제사법위원회 전체회의에서 추미애 위원장이 의사봉을 두드리고 있다. 국민의힘은 더불어민주당의 법안 강행 처리에 반발해 퇴장했다. /연합뉴스"" height=""3616"" width=""5424""/><p>국회 법제사법위원회는 3일 전체회의에서 내란전담재판부 설치법과 고위공직자범죄수사처(공수처)법 개정안, 형법 개정안을 더불어민주당 주도로 처리했다. 국민의힘은 법안 처리에 반대하며 회의에 참석하지 않았다.</p>","국회 법제사법위원회는 3일 전체회의에서 내란전담재판부 설치법과 고위공직자범죄수사처(공수처)법 개정안, 형법 개정안을 더불어민주당 주도로 처리했다. 국민의힘은 법안 처리에 반대하며 회의에 참석하지 않았다.",,,https://www.chosun.com/politics/assembly/2025/12/03/WA5Y35AO7JDIPLFOXQO33QBGRA/
"파수-커넥트AI, 해외 진출 기업 지원 위한 전략적 파트너십 체결",https://www.chosun.com/economy/tech_it/2025/12/04/GYZTGY3FGE2DEZTDMNSDGZJQHA/,"Thu, 04 Dec 2025 00:49:03 +0000",,이경탁 기자(조선비즈)," 파수는 글로벌 디지털 무역 플랫폼 기업 커넥트AI와 해외 진출 기업 지원을 위한 전략적 파트너십을 체결했다고 4일 밝혔다. 양사는 커넥트AI의 글로벌 비즈니스 중개 플랫폼에 파수의 보안 솔루션을 연동한 신규 서비스를 개발하고, 해외 시장으로 진출하는 기업을 위한 보안 역량 강화 지원에 협력한다. 커넥트AI는 국가·시장별 현지 바이어 매칭과 마케팅·사업 제","<img src=""https://www.chosun.com/resizer/v2/GVRWMNJSGE3GCNTDGJTDQYLGMI.jpg?auth=6c97520d8fd7b5a595ab63bc2384f5f13c7456d93784be8e31c8d88f8530bca9&smart=true&width=1600&height=1063"" alt=""지난 3일 서울 상암동 파수 본사에서 개최된 파수와 커넥트AI의 전략적 파트너십 체결식에서 양송이 커넥트AI 대표(왼쪽)와 조규곤 파수 대표가 기념사진을 촬영하고 있다./파수 제공"" height=""1063"" width=""1600""/><p>파수는 글로벌 디지털 무역 플랫폼 기업 커넥트AI와 해외 진출 기업 지원을 위한 전략적 파트너십을 체결했다고 4일 밝혔다.</p>",파수는 글로벌 디지털 무역 플랫폼 기업 커넥트AI와 해외 진출 기업 지원을 위한 전략적 파트너십을 체결했다고 4일 밝혔다.,https://www.chosun.com/resizer/v2/GVRWMNJSGE3GCNTDGJTDQYLGMI.jpg?auth=6c97520d8fd7b5a595ab63bc2384f5f13c7456d93784be8e31c8d88f8530bca9&smart=true&width=1600&height=1063,,https://www.chosun.com/economy/tech_it/2025/12/04/GYZTGY3FGE2DEZTDMNSDGZJQHA/
"드레스 입은 김유정, 한밤의 질주..♥홍종현 벗어나 또 생존할까('친애하는 X')",https://www.chosun.com/entertainments/broadcast/2025/12/04/MNQWENZZMNQWKNBVGBRTSZRVG4/,"Thu, 04 Dec 2025 00:48:18 +0000",,스포츠조선,"[스포츠조선 문지연 기자] '친애하는 X' 백아진 생존기의 마지막 장이다. 티빙 오리지널 '친애하는 X'(최자원 반지운 극본, 이응복 박소현 연출) 측은 11-12회 공개를 앞둔 4일 마침내 위태로운 정상에 다다른 백아진(김유정)과 윤준서(김영대), 김재오(김도훈)의 모습이 담긴 스틸컷을 공개했다. 구원과 파멸의 경계에 놓인 이들의 최후 운명을 궁금케 한다","<img src=""https://www.chosun.com/resizer/v2/MNSDIMJVGZSGMNTFGE4WKMRUGM.jpg?auth=7dfab951c3ca1f46a51ee2b0af7c34abc8afc056196be0bc8c8c8241c0f3ac24&smart=true&width=700&height=945"" alt="""" height=""945"" width=""700""/><p>[스포츠조선 문지연 기자] '친애하는 X' 백아진 생존기의 마지막 장이다.</p>",[스포츠조선 문지연 기자] '친애하는 X' 백아진 생존기의 마지막 장이다.,https://www.chosun.com/resizer/v2/MNSDIMJVGZSGMNTFGE4WKMRUGM.jpg?auth=7dfab951c3ca1f46a51ee2b0af7c34abc8afc056196be0bc8c8c8241c0f3ac24&smart=true&width=700&height=945,,https://www.chosun.com/entertainments/broadcast/2025/12/04/MNQWENZZMNQWKNBVGBRTSZRVG4/
에스파 중국인 멤버 사진 논란에… “日 방송 부르지마” 서명 12만건,https://www.chosun.com/culture-life/k-culture/2025/12/04/L5JRQ3WEN5GYBHO6TVCJNZF7Q4/,"Thu, 04 Dec 2025 00:32:26 +0000",,이가영 기자,,"<img src=""https://www.chosun.com/resizer/v2/KTKWMJY6OBKBLF6ZN7RFAENBE4.JPG?auth=d9cdd2b8a9f4df5496610be05ba29924be9692f92e1c7d564c9c22f799706e5f&smart=true&width=1853&height=2628"" alt=""에스파 닝닝. /뉴스1"" height=""2628"" width=""1853""/><p>일본 NHK가 그룹 에스파의 연말 특집 프로그램 ‘홍백가합전’ 출연에 문제가 없다고 밝혔지만, 에스파 출연 반대 서명에 참여하는 이들은 계속해서 늘고 있다. </p>","일본 NHK가 그룹 에스파의 연말 특집 프로그램 ‘홍백가합전’ 출연에 문제가 없다고 밝혔지만, 에스파 출연 반대 서명에 참여하는 이들은 계속해서 늘고 있다.",,,https://www.chosun.com/culture-life/k-culture/2025/12/04/L5JRQ3WEN5GYBHO6TVCJNZF7Q4/
"양천구, 목동 1~3단지 정비구역 지정… “4만7000세대 신도시급 재건축”",https://www.chosun.com/economy/real_estate/2025/12/04/MIYDCNDFMZRTQNRRMM4TCZLCGM/,"Thu, 04 Dec 2025 00:48:10 +0000",,김보연 기자(조선비즈)," 서울시 양천구는 목동 1~3단지 재건축 정비계획 결정 및 정비구역 지정이 4일 고시됐다고 밝혔다. 이에 따라 목동아파트 14개 단지의 정비구역 지정이 모두 완료, 재건축 사업이 본격 실행 단계에 접어들었다. 양천구는 “연내 모든 단지 정비구역 지정 완료라는 당초 목표를 달성하며, 총 4만7438세대 규모의 ‘신도시급 대규모 주거단지’ 조성이라는 종착역을 ","<img src=""https://www.chosun.com/resizer/v2/MFRTONBTHEYGINBTGZSDCMJVMY.jpg?auth=57c4689131ecff5127fc99238b0fd4f612f670ad4d5c6b4d1522fa0d5edab1ee&smart=true&width=1200&height=696"" alt=""목동1단지 조감도./양천구 제공"" height=""696"" width=""1200""/><p>서울시 양천구는 목동 1~3단지 재건축 정비계획 결정 및 정비구역 지정이 4일 고시됐다고 밝혔다. 이에 따라 목동아파트 14개 단지의 정비구역 지정이 모두 완료, 재건축 사업이 본격 실행 단계에 접어들었다.</p>","서울시 양천구는 목동 1~3단지 재건축 정비계획 결정 및 정비구역 지정이 4일 고시됐다고 밝혔다. 이에 따라 목동아파트 14개 단지의 정비구역 지정이 모두 완료, 재건축 사업이 본격 실행 단계에 접어들었다.",https://www.chosun.com/resizer/v2/MFRTONBTHEYGINBTGZSDCMJVMY.jpg?auth=57c4689131ecff5127fc99238b0fd4f612f670ad4d5c6b4d1522fa0d5edab1ee&smart=true&width=1200&height=696,,https://www.chosun.com/economy/real_estate/2025/12/04/MIYDCNDFMZRTQNRRMM4TCZLCGM/
"김소니아 23득점...BNK, 삼성생명에 72대67 역전승",https://www.chosun.com/sports/basketball/2025/12/03/HURCQ7A6FBGTZNEI6YWPAGOKHI/,"Wed, 03 Dec 2025 12:37:36 +0000",,성진혁 기자,,"<img src=""https://www.chosun.com/resizer/v2/JXWD76THHNG7ZHCOKAVRY3BFFI.jpg?auth=e4fc1d57ec8a218b6127006a4f85dd617e67bb56f961c51b2ff2abe83061ef78&smart=true&width=2475&height=3713"" alt=""BNK의 김소니아(오른쪽)가 3일 삼성생명과 벌인 여자 프로농구 부산 홈 경기에서 골밑 돌파를 하는 모습. /WKBL"" height=""3713"" width=""2475""/><p>부산 BNK가 3일 열린 여자 프로농구 홈경기에서 용인 삼성생명을 72대67로 이겼다. 지난 시즌 챔피언전 우승팀 BNK는 2025-2026시즌 1라운드를 3승 2패, 3위로 마쳤다. </p>","부산 BNK가 3일 열린 여자 프로농구 홈경기에서 용인 삼성생명을 72대67로 이겼다. 지난 시즌 챔피언전 우승팀 BNK는 2025-2026시즌 1라운드를 3승 2패, 3위로 마쳤다.",,,https://www.chosun.com/sports/basketball/2025/12/03/HURCQ7A6FBGTZNEI6YWPAGOKHI/
"'48kg' 이수지, 김사랑에 돌직구..""여우의 향기가 난다""('잘빠지는연애')",https://www.chosun.com/entertainments/broadcast/2025/12/04/HA4WGN3EMY3TOYZSGIYTANLCMY/,"Thu, 04 Dec 2025 00:47:00 +0000",,OSEN,&lt;방송사에서 제공한 자료를 바탕으로 제공된 리뷰 기사입니다.&gt;[OSEN=선미경 기자]&nbsp;'잘 빠지는 연애'&nbsp;회를 거듭할수록 잘빼남녀의 마음이 더 거칠게 요동치고 있다. 이수지는 플러팅으로 판도를 흔든 인천 김사랑에게 돌직구를 던졌다.지난 3일 오후에 방송된&nbsp;TV CHOSUN '잘 빠지는 연애'에서는 잘빼남녀의 관계가 한층,"<img src=""https://www.chosun.com/resizer/v2/G5QWIODFMUYWEY3FMJRDSMZTGA.jpg?auth=b1944ddf129d1e8f59b814746e5accc9c8433c521aaf99e1873889f8b01b1e1b&smart=true&width=530&height=820"" alt="""" height=""820"" width=""530""/><p>&lt;방송사에서 제공한 자료를 바탕으로 제공된 리뷰 기사입니다.&gt;</p>",<방송사에서 제공한 자료를 바탕으로 제공된 리뷰 기사입니다.>,https://www.chosun.com/resizer/v2/G5QWIODFMUYWEY3FMJRDSMZTGA.jpg?auth=b1944ddf129d1e8f59b814746e5accc9c8433c521aaf99e1873889f8b01b1e1b&smart=true&width=530&height=820,,https://www.chosun.com/entertainments/broadcast/2025/12/04/HA4WGN3EMY3TOYZSGIYTANLCMY/
"NHN, AGF 2025 부스·이벤트 공개… ‘어비스디아’·‘최애의 아이’ 출격",https://www.chosun.com/economy/tech_it/2025/12/04/GY3WMMLEHFSWGODFMMYDKMBZHE/,"Thu, 04 Dec 2025 00:46:57 +0000",,이경탁 기자(조선비즈), NHN이 2026년 출시 예정인 수집형 RPG ‘어비스디아’와 3매치 퍼즐 게임 ‘【최애의 아이】Puzzle Star’의 AGF 2025 부스 운영 계획을 4일 공개했다. AGF 2025는 오는 5일부터 7일까지 경기도 고양시 킨텍스에서 진행되는 국내 최대 종합 애니메이션·게임 행사다. NHN은 올해 행사에서 두 타이틀을 중심으로 팬들과 현장에서 만나는 ,"<img src=""https://www.chosun.com/resizer/v2/MY4DEYJTG5QTIMRUMU3DINTCMU.jpg?auth=f2b85208822c5b20e25aaeb29732aecb288bff5feca5ef97564c29910d15cdeb&smart=true&width=4500&height=2535"" alt=""NHN AGF 2025 부스./NHN 제공"" height=""2535"" width=""4500""/><p>NHN이 2026년 출시 예정인 수집형 RPG ‘어비스디아’와 3매치 퍼즐 게임 ‘【최애의 아이】Puzzle Star’의 AGF 2025 부스 운영 계획을 4일 공개했다.</p>",NHN이 2026년 출시 예정인 수집형 RPG ‘어비스디아’와 3매치 퍼즐 게임 ‘【최애의 아이】Puzzle Star’의 AGF 2025 부스 운영 계획을 4일 공개했다.,https://www.chosun.com/resizer/v2/MY4DEYJTG5QTIMRUMU3DINTCMU.jpg?auth=f2b85208822c5b20e25aaeb29732aecb288bff5feca5ef97564c29910d15cdeb&smart=true&width=4500&height=2535,,https://www.chosun.com/economy/tech_it/2025/12/04/GY3WMMLEHFSWGODFMMYDKMBZHE/
[공식]아이유·변우석·공효진 온다…2026년 MBC 초대형 라인업 발표,https://www.chosun.com/entertainments/broadcast/2025/12/04/GQ4WGNRWMZQTKMLFHAZDKNRWHA/,"Thu, 04 Dec 2025 00:46:40 +0000",,스포츠조선,"[스포츠조선 정빛 기자] 드라마 왕국 MBC가 2026년 화려한 라인업을 공개했다. 다양한 장르의 웰메이드 드라마를 선보이며 '드라마 왕국'을 이어온 MBC는 2026년에도 명품 드라마 라인업을 공개하며 시청자들의 기대감을 높이고 있다. 로맨스와 멜로는 물론이고 코미디와 스릴러에서 스포츠 드라마까지, 장르의 폭도 한껏 넓어졌다. 2026년 MBC 드라마의 ","<img src=""https://www.chosun.com/resizer/v2/GZSDEMZWGRRWCMJTMRQTIODGGU.jpg?auth=3777098f730bc4f11470d25db4545f07f35b2fda2cb0601e4a0bda427b8259c3&smart=true&width=700&height=572"" alt=""아이유, 변우석, 공효진(왼쪽부터). 스포츠조선DB"" height=""572"" width=""700""/><p>[스포츠조선 정빛 기자] 드라마 왕국 MBC가 2026년 화려한 라인업을 공개했다.</p>",[스포츠조선 정빛 기자] 드라마 왕국 MBC가 2026년 화려한 라인업을 공개했다.,https://www.chosun.com/resizer/v2/GZSDEMZWGRRWCMJTMRQTIODGGU.jpg?auth=3777098f730bc4f11470d25db4545f07f35b2fda2cb0601e4a0bda427b8259c3&smart=true&width=700&height=572,,https://www.chosun.com/entertainments/broadcast/2025/12/04/GQ4WGNRWMZQTKMLFHAZDKNRWHA/
‘거위털 80%’라더니 ‘재활용’ 다운… 무신사 “신속 환불 조치”,https://www.chosun.com/economy/economy_general/2025/12/04/DPGA5TOEMRHCNKAJJGWZJ2KCQ4/,"Wed, 03 Dec 2025 22:45:58 +0000",,이가영 기자,,"<img src=""https://www.chosun.com/resizer/v2/GVRTQMDFGQ3TKYJUG5QTIMBZMY.jpg?auth=6bdefa6cf9d88f9baf2c0ffd6c1532430f6134b97e9579ea38951b2c9c27b087&smart=true&width=1019&height=689"" alt=""무신사. /뉴스1"" height=""689"" width=""1019""/><p>온라인 패션 플랫폼 무신사가 최근 판매한 패딩 상품의 혼용률을 잘못 기재한 사실을 인정하고 공식 사과했다. 입점 브랜드의 상품 정보 오류 문제를 선제적으로 공개하고, 투명한 환불 조치로 고객 신뢰를 우선시한다는 방침이다. </p>","온라인 패션 플랫폼 무신사가 최근 판매한 패딩 상품의 혼용률을 잘못 기재한 사실을 인정하고 공식 사과했다. 입점 브랜드의 상품 정보 오류 문제를 선제적으로 공개하고, 투명한 환불 조치로 고객 신뢰를 우선시한다는 방침이다.",,,https://www.chosun.com/economy/economy_general/2025/12/04/DPGA5TOEMRHCNKAJJGWZJ2KCQ4/
"트럼프, 美·대만 관계 심화법 서명… 中반발 속 ‘접촉 제한 완화’에 초점",https://www.chosun.com/international/us/2025/12/03/JBY5ICHLBFAVTHJHQZ45PG3RVY/,"Wed, 03 Dec 2025 12:15:19 +0000",,워싱턴=김은중 특파원,,"<img src=""https://www.chosun.com/resizer/v2/YO6HSIPUA5I7XCBVCWEKBV5W7U.jpg?auth=2fc372c0e0802f551f2ece8f2a53168c8da029663c235c5f2dc696211d1f107a&smart=true&width=2580&height=1720"" alt=""도널드 트럼프 미국 대통령(왼쪽)이 2일 백악관 루스벨트룸에서 열린 행사에서 발언을 하고 있다. /로이터 연합뉴스"" height=""1720"" width=""2580""/><p>백악관은 2일 도널드 트럼프 대통령이 국무부가 정부 기관 및 사무소에 ‘대만 관계 지침’을 검토·보고하도록 하는 이른바 ‘대만 보장 이행법(H.R. 1512)’에 서명했다고 밝혔다. 이 법은 미국과 대만과의 관계 심화를 촉진하기 위한 것으로, 미 연방정부 공직자들과 대만 관리들 사이의 접촉 제한 규정을 궁극적으로 타파하는 데 초점을 맞추고 있다. 최근 다카이치 사나에(高市早苗) 일본 총리의 ‘대만 유사 사태’ 발언을 계기로 일본과 중국 관계가 급속도로 얼어붙은 가운데, 미국의 이런 행보가 중국의 어떤 반응을 불러일으킬지 주목된다.</p>","백악관은 2일 도널드 트럼프 대통령이 국무부가 정부 기관 및 사무소에 ‘대만 관계 지침’을 검토·보고하도록 하는 이른바 ‘대만 보장 이행법(H.R. 1512)’에 서명했다고 밝혔다. 이 법은 미국과 대만과의 관계 심화를 촉진하기 위한 것으로, 미 연방정부 공직자들과 대만 관리들 사이의 접촉 제한 규정을 궁극적으로 타파하는 데 초점을 맞추고 있다. 최근 다카이치 사나에(高市早苗) 일본 총리의 ‘대만 유사 사태’ 발언을 계기로 일본과 중국 관계가 급속도로 얼어붙은 가운데, 미국의 이런 행보가 중국의 어떤 반응을 불러일으킬지 주목된다.",,,https://www.chosun.com/international/us/2025/12/03/JBY5ICHLBFAVTHJHQZ45PG3RVY/
"'슬의생' 정경호 실제모델 유재석, ""폐결핵 옮긴 환자와 같은 병실 써"" (유퀴즈)",https://www.chosun.com/entertainments/broadcast/2025/12/04/GNSTQZDBMEZTQNRRGJRDSOLEMU/,"Thu, 04 Dec 2025 00:46:00 +0000",,OSEN,"[OSEN=최이정 기자]&nbsp;tvN '유 퀴즈 온 더 블럭'이&nbsp;'해봐서 압니다'라는 주제를 관통하는 이야기들로&nbsp;시청자들의 호평을 이끌고 있다.&nbsp;지난 3일(수) 방송된 '유 퀴즈 온 더 블럭'(연출 곽청아 허강석, 작가 이언주) 321회에서는 20대 특수청소부 엄우빈, 심장혈관흉부외과 유재석 교수, 주식하는 정신과 전문의 박종","<img src=""https://www.chosun.com/resizer/v2/GIZDGNRWHBSGMOLBMY2DMZBSGI.jpg?auth=cedc0e423d37bd3f70df4c15a68751d6a9eba76e4fcea0480e826517c4abdf81&smart=true&width=650&height=433"" alt="""" height=""433"" width=""650""/><p>[OSEN=최이정 기자]&nbsp;tvN '유 퀴즈 온 더 블럭'이&nbsp;'해봐서 압니다'라는 주제를 관통하는 이야기들로&nbsp;시청자들의 호평을 이끌고 있다.&nbsp;</p>",[OSEN=최이정 기자] tvN '유 퀴즈 온 더 블럭'이 '해봐서 압니다'라는 주제를 관통하는 이야기들로 시청자들의 호평을 이끌고 있다.,https://www.chosun.com/resizer/v2/GIZDGNRWHBSGMOLBMY2DMZBSGI.jpg?auth=cedc0e423d37bd3f70df4c15a68751d6a9eba76e4fcea0480e826517c4abdf81&smart=true&width=650&height=433,,https://www.chosun.com/entertainments/broadcast/2025/12/04/GNSTQZDBMEZTQNRRGJRDSOLEMU/
"'17kg 감량' 곽튜브, 결혼후 확 바뀐 근황..""♥아내 취향"" 파격 비주얼",https://www.chosun.com/entertainments/broadcast/2025/12/04/G4YWINDGGFRTMNRZHA4TEODFGA/,"Thu, 04 Dec 2025 00:44:00 +0000",,OSEN,[OSEN=김나연 기자] 여행 크리에이터 곽튜브(본명 곽준빈)가 결혼 후 확 바뀐 스타일링을 선보였다.3일 '곽튜브' 채널에는 &quot;러시아어 듀오가 고려인마을에 가면 생기는일&quot;이라는 제목의 영상이 업로드 됐다.이날 곽튜브는 tvN '놀라운 토요일' 촬영을 위해 스튜디오를 찾았다. 대기실에서 카메라를 켠 곽튜브는 파격적인 파마 스타일로 눈길을 ,"<img src=""https://www.chosun.com/resizer/v2/GJSWMYRWGMZDCZDCME4WCODGGU.jpg?auth=df3a79a884c0ba505cad2534e1bba2c317756608375c797b537ffbe902345832&smart=true&width=631&height=352"" alt="""" height=""352"" width=""631""/><p>[OSEN=김나연 기자] 여행 크리에이터 곽튜브(본명 곽준빈)가 결혼 후 확 바뀐 스타일링을 선보였다.</p>",[OSEN=김나연 기자] 여행 크리에이터 곽튜브(본명 곽준빈)가 결혼 후 확 바뀐 스타일링을 선보였다.,https://www.chosun.com/resizer/v2/GJSWMYRWGMZDCZDCME4WCODGGU.jpg?auth=df3a79a884c0ba505cad2534e1bba2c317756608375c797b537ffbe902345832&smart=true&width=631&height=352,,https://www.chosun.com/entertainments/broadcast/2025/12/04/G4YWINDGGFRTMNRZHA4TEODFGA/
