title,link,pub_date,category,creator,description,content_html,contents_p,image,comments,guid
“한국 만나면 행운”…월드컵 조 추첨 앞두고 나온 굴욕 평가,https://www.chosun.com/international/international_general/2025/12/04/5X2UY3B37NGVNBHZVVWANLJ5PQ/,"Thu, 04 Dec 2025 00:56:56 +0000",,김자아 기자,,"<img src=""https://www.chosun.com/resizer/v2/QFK6DC4L7NGGTOB5PES2BBS3OY.jpg?auth=ab131c38aff9532dbdf59490ecefb69fbfe273faca007addd197699d1a9ef666&smart=true&width=520&height=293"" alt=""서울월드컵경기장에서 열린 축구대표팀과 파라과이의 평가전에서 그라운드에 나선 홍명보 감독. /조선일보DB"" height=""293"" width=""520""/><p>2026 국제축구연맹(FIFA) 북중미월드컵 조 추첨식을 앞두고, 2022 카타르 월드컵 우승팀인 아르헨티나의 현지 매체가 자국 대표팀이 가장 맞붙기 좋은 국가로 한국을 꼽았다.</p>","2026 국제축구연맹(FIFA) 북중미월드컵 조 추첨식을 앞두고, 2022 카타르 월드컵 우승팀인 아르헨티나의 현지 매체가 자국 대표팀이 가장 맞붙기 좋은 국가로 한국을 꼽았다.",,,https://www.chosun.com/international/international_general/2025/12/04/5X2UY3B37NGVNBHZVVWANLJ5PQ/
"온주완♥방민아, 허례허식 없었다…발리 스몰웨딩 어땠길래",https://www.chosun.com/entertainments/broadcast/2025/12/04/HBRGKNBZHFQTCMJUMEZTEOJWGA/,"Thu, 04 Dec 2025 00:49:00 +0000",,OSEN,,"<img src=""https://www.chosun.com/resizer/v2/MJRGGZLGMI2TMZBYMFSTKMRSME.jpg?auth=7b2d8176952e66088c071199946b7b8abacb7bdbf2c7dae4f9cbe7ba89107b69&smart=true&width=530&height=866"" alt="""" height=""866"" width=""530""/><p>그룹 걸스데이 출신 방민아와 배우 온주완이 발리에서 극비 결혼식을 올린 가운데 두 사람의 럽스타그램을 통해 웨딩 사진이 공개됐다. 화려함과 수많은 하객은 없었지만 그 누구의 결혼식보다도 빛나고 아름다웠다는 반응이 지배적이다.</p>",그룹 걸스데이 출신 방민아와 배우 온주완이 발리에서 극비 결혼식을 올린 가운데 두 사람의 럽스타그램을 통해 웨딩 사진이 공개됐다. 화려함과 수많은 하객은 없었지만 그 누구의 결혼식보다도 빛나고 아름다웠다는 반응이 지배적이다.,https://www.chosun.com/resizer/v2/MJRGGZLGMI2TMZBYMFSTKMRSME.jpg?auth=7b2d8176952e66088c071199946b7b8abacb7bdbf2c7dae4f9cbe7ba89107b69&smart=true&width=530&height=866,,https://www.chosun.com/entertainments/broadcast/2025/12/04/HBRGKNBZHFQTCMJUMEZTEOJWGA/
"해외 IB, 한국 물가상승률 전망 상향... 고환율에 물가 ‘비상’ 관측",https://www.chosun.com/economy/economy_general/2025/12/04/HO4IQWAXUBD2VEZHIHN264PDZ4/,"Wed, 03 Dec 2025 23:39:02 +0000",,강우량 기자,,"<img src=""https://www.chosun.com/resizer/v2/EBLDMTY6HNOVNFCSC4ONXE7LAA.jpg?auth=e2e0f296351b25542f7ad175510b38a94796001b4117786f04d1c9730a245e8e&smart=true&width=2464&height=1586"" alt="" 서울 시내의 주유소에 유가정보가 표시되어 있다./뉴시스"" height=""1586"" width=""2464""/><p>세계 주요 투자은행(IB)들이 한국의 올해와 내년 소비자물가 상승률 전망치를 일제히 높였다. 1400원대에서 고공행진하는 달러 대비 원화 환율로 인해 물가가 뛰어오를 것이란 관측이다.</p>",세계 주요 투자은행(IB)들이 한국의 올해와 내년 소비자물가 상승률 전망치를 일제히 높였다. 1400원대에서 고공행진하는 달러 대비 원화 환율로 인해 물가가 뛰어오를 것이란 관측이다.,,,https://www.chosun.com/economy/economy_general/2025/12/04/HO4IQWAXUBD2VEZHIHN264PDZ4/
김남국 ‘현지 누나’ 인사 청탁에... 與 수석대변인 “범죄는 아니잖아”,https://www.chosun.com/politics/assembly/2025/12/04/DQU5PZUC6ZHIPBGUEWI5PTCTLI/,"Thu, 04 Dec 2025 00:50:39 +0000",,김경필 기자,,"<img src=""https://www.chosun.com/resizer/v2/NQDIGDLXWRMXVGV4CR2425CGOU.jpg?auth=220ced56211c8b194ac403cadf761a4e5b0941f3cc5fec03afb07dbdda25f5fe&smart=true&width=3492&height=2796"" alt=""더불어민주당 박수현 수석대변인. /연합뉴스"" height=""2796"" width=""3492""/><p>김남국 대통령실 디지털소통비서관이 문진석 더불어민주당 의원으로부터 민간 협회장 인사 청탁을 받고 “훈식이 형과 현지 누나에게 추천하겠다”고 답한 대화 내용이 공개된 것에 대해 박수현 민주당 수석대변인은 4일 “범죄 행위와 연관된 성격의 것은 아니다”라며 “당 윤리감찰단에 진상 조사를 지시할 성격(의 일)은 아닌 것 같다”고 말했다.</p>",김남국 대통령실 디지털소통비서관이 문진석 더불어민주당 의원으로부터 민간 협회장 인사 청탁을 받고 “훈식이 형과 현지 누나에게 추천하겠다”고 답한 대화 내용이 공개된 것에 대해 박수현 민주당 수석대변인은 4일 “범죄 행위와 연관된 성격의 것은 아니다”라며 “당 윤리감찰단에 진상 조사를 지시할 성격(의 일)은 아닌 것 같다”고 말했다.,,,https://www.chosun.com/politics/assembly/2025/12/04/DQU5PZUC6ZHIPBGUEWI5PTCTLI/
"충북 실종 여성 살해·은닉... 경찰, 54세 김영우 신상공개 ",https://www.chosun.com/national/incident/2025/12/04/3DXEAAZV6NDPLOMNQXA5R6I5VI/,"Thu, 04 Dec 2025 00:31:59 +0000",,신정훈 기자,,"<img src=""https://www.chosun.com/resizer/v2/OCUJ3F54WNB2FBRA4YV6AZQFBU.png?auth=37cd57fe80888e7266f260bc508e463d01f3cc2160bd5d01f63c854d7796ce19&smart=true&width=480&height=306"" alt="""" height=""306"" width=""480""/><p>청주 장기 실종 여성 살인사건의 범인 김영우(54)의 신상이 4일 공개됐다.</p>",청주 장기 실종 여성 살인사건의 범인 김영우(54)의 신상이 4일 공개됐다.,https://www.chosun.com/resizer/v2/LFWD4LMOXZB5BK3VEOYMPWGUGY.jpg?auth=f0ed21c4815505ee20de00b674eed220aa4e5bdb2dc0d806f34e9801c91e09dd&smart=true&width=181&height=136,,https://www.chosun.com/national/incident/2025/12/04/3DXEAAZV6NDPLOMNQXA5R6I5VI/
[주요경제지표] 2025년 12월 3일자,https://www.chosun.com/economy/stock-finance/2025/12/04/PJH2U4Z5QBD63HS3EZCGLI7R2A/,"Wed, 03 Dec 2025 15:31:00 +0000",,조선일보,,"<img src=""https://www.chosun.com/resizer/v2/3IHTETI7RZGDFP4GYSO4I3GAGY.jpg?auth=15065ab130b9930e349b7f785ce15d126f0680e5f19215978dbe81a70f26a562&smart=true&width=300&height=558"" alt="""" height=""558"" width=""300""/>",,,,https://www.chosun.com/economy/stock-finance/2025/12/04/PJH2U4Z5QBD63HS3EZCGLI7R2A/
"경찰, ‘성추행 의혹’ 장경태 의원 고소인 조사… 진술 확보",https://www.chosun.com/national/national_general/2025/12/04/R32ZA6DQEFGDPLNSYIXK5XR6IU/,"Thu, 04 Dec 2025 00:58:35 +0000",,고유찬 기자,,"<img src=""https://www.chosun.com/resizer/v2/GE3DGY3CGFQTINLBHE3TON3CGM.jpg?auth=9c0cfaea7cc987f03405bd786f29ad1b72d6fd9fe35dd04d37651dec9bfdc402&smart=true&width=3297&height=2198"" alt=""장경태 더불어민주당 의원. /뉴스1"" height=""2198"" width=""3297""/><p>경찰이 더불어민주당 장경태 의원을 준강제추행 혐의로 고소한 여성 비서관을 소환조사했다.</p>",경찰이 더불어민주당 장경태 의원을 준강제추행 혐의로 고소한 여성 비서관을 소환조사했다.,,,https://www.chosun.com/national/national_general/2025/12/04/R32ZA6DQEFGDPLNSYIXK5XR6IU/
“얼간이가 얼마를 지불할까”… 故 매슈 페리에 케타민 공급 의사 징역형,https://www.chosun.com/international/international_general/2025/12/04/MYYTQZBYMFSGIMBVGM4DGNJTMY/,"Thu, 04 Dec 2025 01:03:03 +0000",,배동주 기자(조선비즈), 미국 드라마 ‘프렌즈’ 속 ‘채들러 빙’ 역할로 인기를 끈 배우 고(故) 매튜 페리의 담당 의사가 징역형을 선고받았다. 마약성 약물인 케타민을 불법으로 공급한 혐의다. 3일(현지 시각) AP와 로이터통신 등 외신에 따르면 로스앤젤레스(LA) 연방법원 셔릴린 피스 가넷 판사는 케타민 불법 유통 혐의로 기소된 의사 살바도르 플라센시아(44)에게 징역 2년 6,"<img src=""https://www.chosun.com/resizer/v2/GJRDGYZTMEYTIYZZGI2TIM3DHE.jpg?auth=9a211e903a18b4b928f77969bb3d602e9d44a918ca995f5b4869ceac15a8c136&smart=true&width=647&height=466"" alt=""고(故) 매슈 페리. /AFP연합뉴스"" height=""466"" width=""647""/><p>미국 드라마 ‘프렌즈’ 속 ‘채들러 빙’ 역할로 인기를 끈 배우 고(故) 매튜 페리의 담당 의사가 징역형을 선고받았다. 마약성 약물인 케타민을 불법으로 공급한 혐의다.</p>",미국 드라마 ‘프렌즈’ 속 ‘채들러 빙’ 역할로 인기를 끈 배우 고(故) 매튜 페리의 담당 의사가 징역형을 선고받았다. 마약성 약물인 케타민을 불법으로 공급한 혐의다.,https://www.chosun.com/resizer/v2/GJRDGYZTMEYTIYZZGI2TIM3DHE.jpg?auth=9a211e903a18b4b928f77969bb3d602e9d44a918ca995f5b4869ceac15a8c136&smart=true&width=647&height=466,,https://www.chosun.com/international/international_general/2025/12/04/MYYTQZBYMFSGIMBVGM4DGNJTMY/
"[팔면봉] 12·3 계엄 1년, ‘내란 청산’ 아직 멀었다고 하는 이재명 정부, 사골도 이 정도로 우리면 맛 없다는 말 나올텐데. 외",https://www.chosun.com/opinion/palmyeonbong/2025/12/04/UR6N4L5HX5GELOLFR6GH2CIQSU/,"Wed, 03 Dec 2025 15:25:00 +0000",,조선일보,,"<p>○12·3 계엄 1년, ‘내란 청산’ 아직 멀었다고 하는 이재명 정부, 사골도 이 정도로 우리면 맛 없다는 말 나올텐데.</p><p>○내란특검, 추경호 영장 기각되자 불구속 기소하기로. “국힘 해산” 외치는 누군가 눈치 본 건 아니겠지?</p>","○12·3 계엄 1년, ‘내란 청산’ 아직 멀었다고 하는 이재명 정부, 사골도 이 정도로 우리면 맛 없다는 말 나올텐데.",,,https://www.chosun.com/opinion/palmyeonbong/2025/12/04/UR6N4L5HX5GELOLFR6GH2CIQSU/
"[특징주] “글로벌 제약사와 협업 기대감”… 뉴로핏, 증권사 호평에 3%대 상승 ",https://www.chosun.com/economy/stock-finance/2025/12/04/HA3DEN3DMM2TIYJTMQ3DOMJUG4/,"Thu, 04 Dec 2025 01:02:08 +0000",,"황채영 기자(조선비즈), 조은서 기자(조선비즈)", 4일 오전 뉴로핏 주가가 3% 넘게 오르고 있다. 글로벌 제약사들과 협업 결과가 기대된다는 증권사 분석에 매수세가 몰린 것으로 풀이된다. 이날 오전 10시 1분 기준 뉴로핏은 코스닥시장에서 전 거래일 대비 1100원(3.77%) 오른 3만250원에 거래되고 있다. 개장 직후 주가는 3만4400원까지 뛰며 1년 중 최고가를 경신했다. 한승연 NH투자증권 연,"<img src=""https://www.chosun.com/resizer/v2/GFQTMOLGMVQTCNBQHEZDAZDCGY.jpg?auth=a7c73fbfca2ca3cd3fc71302f914e4faaf5549118bdeda7857d776eb3c6b51ba&smart=true&width=1920&height=1080"" alt=""뉴로핏 로고./뉴로핏 제공"" height=""1080"" width=""1920""/><p>4일 오전 뉴로핏 주가가 3% 넘게 오르고 있다. 글로벌 제약사들과 협업 결과가 기대된다는 증권사 분석에 매수세가 몰린 것으로 풀이된다.</p>",4일 오전 뉴로핏 주가가 3% 넘게 오르고 있다. 글로벌 제약사들과 협업 결과가 기대된다는 증권사 분석에 매수세가 몰린 것으로 풀이된다.,https://www.chosun.com/resizer/v2/GFQTMOLGMVQTCNBQHEZDAZDCGY.jpg?auth=a7c73fbfca2ca3cd3fc71302f914e4faaf5549118bdeda7857d776eb3c6b51ba&smart=true&width=1920&height=1080,,https://www.chosun.com/economy/stock-finance/2025/12/04/HA3DEN3DMM2TIYJTMQ3DOMJUG4/
"감독 교체에도.. '선발 NO→황희찬 교체 출전' 울버햄튼, 또또또또또또또 EPL 첫승 불발! 노팅엄에 0-1 패",https://www.chosun.com/sports/world-football/2025/12/04/GBTDQNJUMIYDIYZTMU2WGNTBGY/,"Thu, 04 Dec 2025 01:02:00 +0000",,OSEN,"[OSEN=노진주 기자] 황희찬(29, 울버햄튼)이 교체 출전한 가운데, 팀은 패배를 피하지 못했다.울버햄튼은 4일(한국시간) 영국 버밍엄 몰리뉴 스타디움에서 열린 2025-2026 프리미어리그 14라운드 홈 경기에서 노팅엄 포레스트에 0-1로 패했다.이날 결과로 울버햄튼은 2무 12패(승점 2)를 기록, 리그 최하위 20위에 머물러 있다. 리그 7연패. ","<img src=""https://www.chosun.com/resizer/v2/GYZTCZBSGZSTKZDFGAZGIODCMM.jpg?auth=4c1e612769e23f577e15c06e4aedd54e1371050bf53fe92b968538793aa33410&smart=true&width=594&height=424"" alt="""" height=""424"" width=""594""/><p>[OSEN=노진주 기자] 황희찬(29, 울버햄튼)이 교체 출전한 가운데, 팀은 패배를 피하지 못했다.</p>","[OSEN=노진주 기자] 황희찬(29, 울버햄튼)이 교체 출전한 가운데, 팀은 패배를 피하지 못했다.",https://www.chosun.com/resizer/v2/GYZTCZBSGZSTKZDFGAZGIODCMM.jpg?auth=4c1e612769e23f577e15c06e4aedd54e1371050bf53fe92b968538793aa33410&smart=true&width=594&height=424,,https://www.chosun.com/sports/world-football/2025/12/04/GBTDQNJUMIYDIYZTMU2WGNTBGY/
美국무부 선임 부차관보 “한국과 협력해 대만해협 등서 평화·안정 수호”,https://www.chosun.com/international/us/2025/12/04/H7S5HG4BMJEWXFY26XRMB66AJM/,"Wed, 03 Dec 2025 15:00:57 +0000",,워싱턴=김은중 특파원,,"<img src=""https://www.chosun.com/resizer/v2/ZBDRGXRL4VEX7GJCJJCKRJJTWY.jpg?auth=2d4a7773ba227a4672e3133dc278429bc676b0ebd6cdd67d90f988732db9b66b&smart=true&width=858&height=564"" alt=""조너선 프리츠 미 국무부 동아태 선임 부차관보가 3일 한국국제교류재단(KF)과 전략국제문제연구소(CSIS)가 주최한 제10차 'KF-CSIS 한미전략포럼'에 참석해 기조 연설을 하고 있다. /CSIS"" height=""564"" width=""858""/><p>조너선 프리츠 미 국무부 동아시아·태평양 담당 선임 부차관보는 3일 “우리는 한국과 인도·태평양 지역의 다른 파트너들과 협력해 국제 해양법과 평화·안정을 수호할 것”이라며 “이는 대만해협과 남중국해, 또는 그 너머 이 지역 다른 곳에서도 마찬가지”라고 했다. 프리츠는 한미가 지난달 발표한 팩트시트(factsheet·설명 자료)와 관련해 “핵심 산업 재건, 상업적 유대 강화, 한반도와 더 넓은 지역에 대한 협력 등을 망라하고 있다”며 “한국은 미국의 재산업화 추진에 있어 절대적으로 핵심적인 역할을 하고 있다”고 했다.</p>","조너선 프리츠 미 국무부 동아시아·태평양 담당 선임 부차관보는 3일 “우리는 한국과 인도·태평양 지역의 다른 파트너들과 협력해 국제 해양법과 평화·안정을 수호할 것”이라며 “이는 대만해협과 남중국해, 또는 그 너머 이 지역 다른 곳에서도 마찬가지”라고 했다. 프리츠는 한미가 지난달 발표한 팩트시트(factsheet·설명 자료)와 관련해 “핵심 산업 재건, 상업적 유대 강화, 한반도와 더 넓은 지역에 대한 협력 등을 망라하고 있다”며 “한국은 미국의 재산업화 추진에 있어 절대적으로 핵심적인 역할을 하고 있다”고 했다.",,,https://www.chosun.com/international/us/2025/12/04/H7S5HG4BMJEWXFY26XRMB66AJM/
"유니콘 기업, 韓 2개 늘어 13개… 美는 229개 늘어 717개 압도적",https://www.chosun.com/economy/industry-company/2025/12/04/OAQL6WLU2VHKBCWAH4GJ67L45I/,"Wed, 03 Dec 2025 15:32:00 +0000",,한예나 기자,,"<p>한국의 유니콘 기업 보유 수가 13개로 세계 11위에 머물렀다. 유니콘 기업은 기업 가치가 10억달러 이상인 비상장 기업으로, 혁신 성장의 척도로 평가받는다. 유니콘 기업 배출이 주요국보다 크게 뒤처지면서 한국 스타트업 생태계 전반의 활력이 떨어지고 있다는 지적이 나온다.</p><img src=""https://www.chosun.com/resizer/v2/P5752H2IIRG3DCSH6J26IMCQUA.png?auth=062add6c4b02edb413fbddb0dca040c253fcde52a1e12425c466c2ede0496282&smart=true&width=480&height=590"" alt=""그래픽=조선디자인랩 이연주"" height=""590"" width=""480""/>","한국의 유니콘 기업 보유 수가 13개로 세계 11위에 머물렀다. 유니콘 기업은 기업 가치가 10억달러 이상인 비상장 기업으로, 혁신 성장의 척도로 평가받는다. 유니콘 기업 배출이 주요국보다 크게 뒤처지면서 한국 스타트업 생태계 전반의 활력이 떨어지고 있다는 지적이 나온다.",,,https://www.chosun.com/economy/industry-company/2025/12/04/OAQL6WLU2VHKBCWAH4GJ67L45I/
[특징주] 9.7 공급 대책 가속화 기대감에…건설株 급등,https://www.chosun.com/economy/stock-finance/2025/12/04/MJRDAMBQHFRDMOLGGNRDIODDHA/,"Thu, 04 Dec 2025 01:00:06 +0000",,김정은 기자(조선비즈),중소형 건설주들이 4일 급등했다. 김이탁 신임 국토교통부 1차관이 “9·7 공급 대책의 후속 조치를 속도감 있게 이행하겠다”고 밝히면서 투자 심리를 자극한 것으로 분석된다.  이날 오전 9시 54분 기준 코스닥 시장에서 상지건설은 가격제한폭(29.99%)까지 뛰며 9840원에 거래되고 있다. 같은 시각 동신건설과 일신건설도 전 거래일 대비 각각 25.63%,"<p>중소형 건설주들이 4일 급등했다. 김이탁 신임 국토교통부 1차관이 “9·7 공급 대책의 후속 조치를 속도감 있게 이행하겠다”고 밝히면서 투자 심리를 자극한 것으로 분석된다.</p><img src=""https://www.chosun.com/resizer/v2/MJSTCZBVGBSDSNRUME2TEZTGGQ.jpg?auth=906d7acaf832b3e56f244caec35f580dc056f27a9ba66f8ffaf2f56d08213b68&smart=true&width=4693&height=3129"" alt=""김이탁 신임 국토교통부 1차관이 지난 2일 오전 정부세종청사에서 열린 취임식에서 선서를 하고 있다. /국토교통부 제공"" height=""3129"" width=""4693""/>",중소형 건설주들이 4일 급등했다. 김이탁 신임 국토교통부 1차관이 “9·7 공급 대책의 후속 조치를 속도감 있게 이행하겠다”고 밝히면서 투자 심리를 자극한 것으로 분석된다.,https://www.chosun.com/resizer/v2/MJSTCZBVGBSDSNRUME2TEZTGGQ.jpg?auth=906d7acaf832b3e56f244caec35f580dc056f27a9ba66f8ffaf2f56d08213b68&smart=true&width=4693&height=3129,,https://www.chosun.com/economy/stock-finance/2025/12/04/MJRDAMBQHFRDMOLGGNRDIODDHA/
주택금융·무역보험공사도 새도약기금에 연체 채권 매각,https://www.chosun.com/economy/stock-finance/2025/12/04/MU4TAYRUMY2TKMRZMU2TEYZVHE/,"Thu, 04 Dec 2025 01:00:00 +0000",,송기영 기자(조선비즈),"이재명 정부의 핵심 정책 중 하나인 새도약기금에 주택금융공사(주금공)와 무역보험공사(무보)도 연체 채권을 매각한다. 새도약기금은 금융위원회와 한국자산관리공사(캠코)가 공동으로 추진하는 장기 연체자 재기 지원 프로그램으로, 금융권이 보유한 7년 이상·5000만원 이하 무담보 연체 채권을 싸게 매입한다. 4일 금융권에 따르면 주금공과 무보는 새도약기금 협약에 ","<p>이재명 정부의 핵심 정책 중 하나인 새도약기금에 주택금융공사(주금공)와 무역보험공사(무보)도 연체 채권을 매각한다. 새도약기금은 금융위원회와 한국자산관리공사(캠코)가 공동으로 추진하는 장기 연체자 재기 지원 프로그램으로, 금융권이 보유한 7년 이상·5000만원 이하 무담보 연체 채권을 싸게 매입한다.</p><p>4일 금융권에 따르면 주금공과 무보는 새도약기금 협약에 가입하고 이달 중 채권 매각을 진행할 계획이다. 이들 기관은 당초 새도약기금 협약 기관에 포함되지 않았었다. 정책금융기관 중에는 신용보증기금과 기술보증기금이 최근 협약 가입을 완료하고 채권 매각 협의를 진행 중인 것으로 전해졌다.</p>","이재명 정부의 핵심 정책 중 하나인 새도약기금에 주택금융공사(주금공)와 무역보험공사(무보)도 연체 채권을 매각한다. 새도약기금은 금융위원회와 한국자산관리공사(캠코)가 공동으로 추진하는 장기 연체자 재기 지원 프로그램으로, 금융권이 보유한 7년 이상·5000만원 이하 무담보 연체 채권을 싸게 매입한다.",https://www.chosun.com/resizer/v2/G43DENJZME3TSNBWMFRWINBVGA.jpg?auth=b6bfebd4d72005962fdf6a0cdc4a93bad138d648de6fbd34868070732220ff19&smart=true&width=5000&height=3247,,https://www.chosun.com/economy/stock-finance/2025/12/04/MU4TAYRUMY2TKMRZMU2TEYZVHE/
"키키 수이, 데뷔 9개월만 'ACON 2025' MC 출격..글로벌 무대 활약",https://www.chosun.com/entertainments/music/2025/12/04/GFRTIMZQMU4WGYRUGRSDQNJZME/,"Thu, 04 Dec 2025 01:00:00 +0000",,OSEN,"[OSEN=선미경 기자] 그룹 키키(KiiiKiii)의 수이가 글로벌 무대의 MC로 출격한다.4일 시상식 '아시아 아티스트 어워즈(Asia Artist Awards, 이하 'AAA')'에 따르면, 수이는 오는 7일 가오슝 내셔널 스타디움에서 열리는 10주년 AAA 페스타 'ACON 2025' MC로 발탁됐다. 이는 수이의 첫 글로벌 무대 MC 도전으로, 정","<img src=""https://www.chosun.com/resizer/v2/HBTGKM3EGQ4TMZLEGAZTAZJSGY.jpg?auth=4bfe03f45f26c1be452a3772f4632055ad05e60457b6df2fa7222467a0403049&smart=true&width=650&height=433"" alt="""" height=""433"" width=""650""/><p>[OSEN=선미경 기자] 그룹 키키(KiiiKiii)의 수이가 글로벌 무대의 MC로 출격한다.</p>",[OSEN=선미경 기자] 그룹 키키(KiiiKiii)의 수이가 글로벌 무대의 MC로 출격한다.,https://www.chosun.com/resizer/v2/HBTGKM3EGQ4TMZLEGAZTAZJSGY.jpg?auth=4bfe03f45f26c1be452a3772f4632055ad05e60457b6df2fa7222467a0403049&smart=true&width=650&height=433,,https://www.chosun.com/entertainments/music/2025/12/04/GFRTIMZQMU4WGYRUGRSDQNJZME/
"금감원, 해외 부동산 펀드 집중심사제 도입… 실사 보고서 첨부 의무화",https://www.chosun.com/economy/stock-finance/2025/12/04/GIZGINZXMM2TSOJUMIZWENDGGA/,"Thu, 04 Dec 2025 01:00:00 +0000",,강정아 기자(조선비즈), 금융감독원이 해외 부동산 펀드 상품 설계 과정부터 빈틈없는 심사 체계 가동을 위해 해외 부동산 펀드 집중 심사제를 도입한다고 밝혔다. 금감원은 4일 해외 부동산펀드를 주로 취급하는 6개 자산운용사 대표이사 및 금융투자협회 담당 본부장과 여의도 본원에서 간담회를 열고 이같은 내용을 논의했다고 밝혔다. 먼저 최근 실시한 설계·제조 단계 내부통제 체계 점검 결,"<img src=""https://www.chosun.com/resizer/v2/GMZGEZBRHBRDQNRRMFRTOZDCME.jpg?auth=63591c65de48f8d91119ba078dd788d45b11f5b2f52d331eca59d262d325fec6&smart=true&width=5000&height=3333"" alt=""서울 여의도 금융감독원 모습. /뉴스1"" height=""3333"" width=""5000""/><p>금융감독원이 해외 부동산 펀드 상품 설계 과정부터 빈틈없는 심사 체계 가동을 위해 해외 부동산 펀드 집중 심사제를 도입한다고 밝혔다.</p>",금융감독원이 해외 부동산 펀드 상품 설계 과정부터 빈틈없는 심사 체계 가동을 위해 해외 부동산 펀드 집중 심사제를 도입한다고 밝혔다.,https://www.chosun.com/resizer/v2/GMZGEZBRHBRDQNRRMFRTOZDCME.jpg?auth=63591c65de48f8d91119ba078dd788d45b11f5b2f52d331eca59d262d325fec6&smart=true&width=5000&height=3333,,https://www.chosun.com/economy/stock-finance/2025/12/04/GIZGINZXMM2TSOJUMIZWENDGGA/
SK 보령LNG터미널 인수금융 재매각 ‘불티’... “물량 없어서 못판다”,https://www.chosun.com/economy/stock-finance/2025/12/04/GJRDEOBQGIZDAMDCMQYDOZJXHA/,"Thu, 04 Dec 2025 01:00:00 +0000",,노자운 기자(조선비즈)," 이 기사는 2025년 12월 3일 17시 44분 조선비즈 머니무브(MM) 사이트에 표출됐습니다. SK이노베이션의 보령 액화천연가스(LNG)터미널 지분 50% 인수를 위해 대주단이 인수금융 셀다운(인수 후 재매각)에 나선 가운데, 수요가 몰리며 물량이 순식간에 소진된 것으로 전해졌다. 이번 인수금융 셀다운이 흥행에 성공한 것은 그만큼 기관들이 보령 LNG터","<img src=""https://www.chosun.com/resizer/v2/BIWPCS4SLLWM5MIFFSLWSTVMBM.png?auth=9e8223faee6a8907ebecf3c6858dfb3485e857f8a14969b34ec9136efd911ece&smart=true&width=1080&height=1100"" alt=""SK이노베이션 보령 LNG터미널. /SK이노베이션 E&S 제공"" height=""1100"" width=""1080""/><p><b>이 기사는 2025년 12월 3일 17시 44분 조선비즈 머니무브(MM) 사이트에 표출됐습니다.</b></p>",이 기사는 2025년 12월 3일 17시 44분 조선비즈 머니무브(MM) 사이트에 표출됐습니다.,https://www.chosun.com/resizer/v2/BIWPCS4SLLWM5MIFFSLWSTVMBM.png?auth=9e8223faee6a8907ebecf3c6858dfb3485e857f8a14969b34ec9136efd911ece&smart=true&width=1080&height=1100,,https://www.chosun.com/economy/stock-finance/2025/12/04/GJRDEOBQGIZDAMDCMQYDOZJXHA/
